{"artifacts":[{"logical_path":"dryrun/frontier_baseline.json","media_type":"application/json","role":"baseline-frontier","sha256":"118c86270d4432914efb383b519a2b3b179892c4180199a49b7314d2912048fa","size_bytes":1295224},{"logical_path":"dryrun/frontier_baseline.sha256","media_type":"text/plain","role":"baseline-payload-sidecar","sha256":"7972e45ce65d73da23c20bd62705ae9e2e0378dcee78eb088881b48c4d9558ff","size_bytes":118},{"logical_path":"p1/e1/out/actual_frontier.json","media_type":"application/json","role":"e1-frontier-payload","sha256":"e5db97cac0ef4ec037e3286b410508a004aebbbd3ad83a88f99c6364e1f2cd8b","size_bytes":1668663},{"logical_path":"p1/e1/out/artifact_manifest.json","media_type":"application/json","role":"e1-artifact-manifest","sha256":"4608e303a70274b4cd0f33e829c539529207462d1292d580d3ccac303d633d61","size_bytes":541},{"logical_path":"p1/e1/out/mismatches.json","media_type":"application/json","role":"e1-mismatch-bundle","sha256":"f9ccf37dbeee39d5a5c001171b46370e1ad3b1c6d45c32b7a38d7e01b9d8abb0","size_bytes":97},{"logical_path":"p1/e1/out/parity_report.json","media_type":"application/json","role":"e1-parity-report","sha256":"004acd113862c85921deb3f75f6cf8ac43097d9d045b7eaf9077e8a5c668b32e","size_bytes":2834},{"logical_path":"p1/e2/fixtures.json","media_type":"application/json","role":"fixture-definition-set","sha256":"3437ad9b81c4ef4a267413b00a8b6843432a19b41d048d43f046b585cf8179e6","size_bytes":3164},{"logical_path":"p1/e2/reports/fixture_agreement.json","media_type":"application/json","role":"fixture-agreement","sha256":"bb03cd2b183b68149d40430ab6a2f62b97b6a7c2d574cf19130467d55eaf4531","size_bytes":5014},{"logical_path":"p1/e2/reports/fixtures/buch_n3_interval.report.json","media_type":"application/json","role":"fixture-comparison-report","sha256":"b79d0ba39e5a3ba1593e8915da111fb429b7fb68502a6ae628d03244bf806955","size_bytes":7399},{"logical_path":"p1/e2/reports/fixtures/campaign_degree6_anchor.report.json","media_type":"application/json","role":"fixture-comparison-report","sha256":"08693e852703945f107876e9fca8ac650911e594ee4e383fca4fa9346bbbc853","size_bytes":12599},{"logical_path":"p1/e2/reports/fixtures/n2_no_interior_vertex.report.json","media_type":"application/json","role":"fixture-comparison-report","sha256":"6b3692d40fa7dfd546c670546a5c8abb5febe9f8f5d38e60f9b1047a8d93b679","size_bytes":3898},{"logical_path":"p1/e2/reports/fixtures/n3_degenerate_point.report.json","media_type":"application/json","role":"fixture-comparison-report","sha256":"cf2363b9bf8332535a675736eef2f8d6e6e2aa6a589a5a44c0bf1cdba5d593e7","size_bytes":5915},{"logical_path":"p1/e2/reports/fixtures/n3_empty_horn_failure.report.json","media_type":"application/json","role":"fixture-comparison-report","sha256":"c42d05479fde5ddc0da028d3b1d7862d13fe9ed906ef1849052cf317b415098c","size_bytes":5601},{"logical_path":"p1/e2/reports/fixtures/n4_asymmetric_degree2.report.json","media_type":"application/json","role":"fixture-comparison-report","sha256":"2af9ccda06cd9de743ae384c3d2acd08fd6b9adaa15bc365e44a246430181f00","size_bytes":5993},{"logical_path":"p1/e2/reports/fixtures_summary.json","media_type":"application/json","role":"e2-fixture-summary","sha256":"bfeccc7b7671f41392c48b488ed70327d55f0346e559afa643ab743184266282","size_bytes":3005},{"logical_path":"p1/e2/reports/fixtures_summary.sha256","media_type":"text/plain","role":"e2-summary-sidecar","sha256":"193b40d3df0783bbc59c078f9185eb46a1e0e2f80f3150c2e760448bc8b30f28","size_bytes":121},{"logical_path":"p1/e2/reports/inputs/buch_n3_interval.hive.json","media_type":"application/json","role":"explicit-hive-input","sha256":"4e880f66f5c6a113c5ab5e03172b12d862fd221404c0fa99c1700221fb4fa2ad","size_bytes":7041},{"logical_path":"p1/e2/reports/inputs/campaign_degree6_anchor.hive.json","media_type":"application/json","role":"explicit-hive-input","sha256":"39bcc872314c817e564a7f4e7ea6c0394bfc41246d02af816260c472028a3c69","size_bytes":25272},{"logical_path":"p1/e2/reports/inputs/n2_no_interior_vertex.hive.json","media_type":"application/json","role":"explicit-hive-input","sha256":"6657965fc5d75178926b464f763c87b271e8fbb8f19c606cc82e2f7a170b7542","size_bytes":2707},{"logical_path":"p1/e2/reports/inputs/n3_degenerate_point.hive.json","media_type":"application/json","role":"explicit-hive-input","sha256":"227d838c29ea85408e24e33150cb5bfc4de512a0d46644aecb4e54cac9c509ec","size_bytes":7034},{"logical_path":"p1/e2/reports/inputs/n3_empty_horn_failure.hive.json","media_type":"application/json","role":"explicit-hive-input","sha256":"f96e817d9caa2ca6973a8993bad65c72785fc2f5a716dbcdcb571e1f540e88b3","size_bytes":7034},{"logical_path":"p1/e2/reports/inputs/n4_asymmetric_degree2.hive.json","media_type":"application/json","role":"explicit-hive-input","sha256":"59057e98afd59ff7a4df79fd9f3d7102de44225a17a40faa43b55e14fcbda893","size_bytes":14182},{"logical_path":"p1/e2/reports/lrcalc_interp_evaluator.json","media_type":"application/json","role":"fixture-evaluator-lrcalc","sha256":"73656dd11ce194b1038091fd2d471eb7dac85fe8f187e8186cb2bdc9bb961a98","size_bytes":1730},{"logical_path":"p1/e2/reports/normaliz/buch_n3_interval.in","media_type":"text/plain","role":"normaliz-input","sha256":"fca65c8e0d37ca0ecb5fc57cad93babfe659f63ebe1a8f96339ad7c7a50e439b","size_bytes":199},{"logical_path":"p1/e2/reports/normaliz/buch_n3_interval.out","media_type":"text/plain","role":"normaliz-raw-output","sha256":"b43e37c24768f1d6a47c970d86e1225c56f9491de6ea02a6a3678afd53c41949","size_bytes":960},{"logical_path":"p1/e2/reports/normaliz/campaign_degree6_anchor.in","media_type":"text/plain","role":"normaliz-input","sha256":"b9ae933a8af2445a2b1e6f06bf0593df06679c53c2e0ca8a31a95e7f125c0fad","size_bytes":631},{"logical_path":"p1/e2/reports/normaliz/campaign_degree6_anchor.out","media_type":"text/plain","role":"normaliz-raw-output","sha256":"2b4e264acd21a8897af38494407b19e120cc24b60c34f3ae95abd52c4b74b58f","size_bytes":2323},{"logical_path":"p1/e2/reports/normaliz/n3_degenerate_point.in","media_type":"text/plain","role":"normaliz-input","sha256":"ab5ac63e554fe94771ad8bc8f9f317b63b379ddead9fe78be191162ef59014dd","size_bytes":199},{"logical_path":"p1/e2/reports/normaliz/n3_degenerate_point.out","media_type":"text/plain","role":"normaliz-raw-output","sha256":"dc16bb13ad74fe7558cd0810c9c16f8625cb0889a7dc8abefc8c4ae04c8e3193","size_bytes":995},{"logical_path":"p1/e2/reports/normaliz/n3_empty_horn_failure.in","media_type":"text/plain","role":"normaliz-input","sha256":"296af9413bc859a43cc06d5f50b1f52ce110d4c9e38fedb4d54a29d0e9c95f6f","size_bytes":199},{"logical_path":"p1/e2/reports/normaliz/n3_empty_horn_failure.out","media_type":"text/plain","role":"normaliz-raw-output","sha256":"e67c6ccbeb6d7ae09066565a55899a15d13aadfee68137d574240e92ad25c930","size_bytes":1260},{"logical_path":"p1/e2/reports/normaliz/n4_asymmetric_degree2.in","media_type":"text/plain","role":"normaliz-input","sha256":"e14ce59c1b4eacdab5ca88b760d185ebf9bfec2f04598544d5210a763cf1da4c","size_bytes":323},{"logical_path":"p1/e2/reports/normaliz/n4_asymmetric_degree2.out","media_type":"text/plain","role":"normaliz-raw-output","sha256":"9257a1001b212511763706ffdb29faaea3b344976ce20fd8703044bb579e9011","size_bytes":1107},{"logical_path":"p1/e2/reports/normaliz_ehrhart_evaluator.json","media_type":"application/json","role":"fixture-evaluator-normaliz","sha256":"cd0545f384c051e2b9f7f1ad516a2cdf1edca9cffcf5984c703d12b6b5f8ee7a","size_bytes":4179}],"created_utc":"2026-07-23T18:03:02Z","manifest_id":"sha256:6b46ac58177af8b39942c595ef7568f6af836c02a0cbbef45dc19bbe8a31db0e","producer":{"actor":"integrator","tool":"p1.integrate_p1","tool_version":"1.0.0","writer_id":"codex-root"},"schema_version":"lr-artifact-manifest/v1","scope":"P1 oracle parity and fixed independent hive-fixture evidence"}
